{
  "bank": 1.8,
  "chip_history": [],
  "chips_available": [
    "wildcard_fh",
    "free_hit_fh",
    "triple_captain_fh",
    "bench_boost_fh",
    "wildcard_sh",
    "free_hit_sh",
    "triple_captain_sh",
    "bench_boost_sh"
  ],
  "content_sha256": "b183d6964308f46f76cb0eb489674d85d8047baa5bc71824355469b82419be06",
  "cumulative_points": 277,
  "free_transfers": 3,
  "gameweek": 6,
  "origin": {
    "seed_id": "benchmark-v0-official-scout-gw1",
    "seed_sha256": "e0d798bcfd3a527ac896ed6c7191376d9ef7a8f776fb0ec1fe71f4bdcbbd0297",
    "type": "controlled_shared_seed"
  },
  "policy_arm": "human_decision",
  "previous_state_sha256": "1c15bc16df24059d2553b671a086d79935b3fd9eeef436343beec345775c2349",
  "ruleset_id": "2025-26-v1.0",
  "ruleset_sha256": "376e6a7982b54bce8562a73cfd749f30c2d869c50bfa036a531b96c90bb5a809",
  "schema_version": "1.0",
  "season": "2025-26",
  "squad": [
    {
      "club_id": "team:2025-26:7",
      "current_price": 5.0,
      "player_id": "player:2025-26:220",
      "position": "GKP",
      "purchase_price": 5.0,
      "selling_price": 5.0
    },
    {
      "club_id": "team:2025-26:7",
      "current_price": 7.8,
      "player_id": "player:2025-26:249",
      "position": "FWD",
      "purchase_price": 7.5,
      "selling_price": 7.6
    },
    {
      "club_id": "team:2025-26:7",
      "current_price": 4.4,
      "player_id": "player:2025-26:252",
      "position": "FWD",
      "purchase_price": 4.5,
      "selling_price": 4.4
    },
    {
      "club_id": "team:2025-26:9",
      "current_price": 5.5,
      "player_id": "player:2025-26:291",
      "position": "DEF",
      "purchase_price": 5.5,
      "selling_price": 5.5
    },
    {
      "club_id": "team:2025-26:11",
      "current_price": 4.0,
      "player_id": "player:2025-26:348",
      "position": "DEF",
      "purchase_price": 4.0,
      "selling_price": 4.0
    },
    {
      "club_id": "team:2025-26:12",
      "current_price": 14.5,
      "player_id": "player:2025-26:381",
      "position": "MID",
      "purchase_price": 14.5,
      "selling_price": 14.5
    },
    {
      "club_id": "team:2025-26:12",
      "current_price": 7.7,
      "player_id": "player:2025-26:384",
      "position": "MID",
      "purchase_price": 7.6,
      "selling_price": 7.6
    },
    {
      "club_id": "team:2025-26:12",
      "current_price": 6.5,
      "player_id": "player:2025-26:387",
      "position": "MID",
      "purchase_price": 6.5,
      "selling_price": 6.5
    },
    {
      "club_id": "team:2025-26:13",
      "current_price": 5.7,
      "player_id": "player:2025-26:427",
      "position": "MID",
      "purchase_price": 5.5,
      "selling_price": 5.6
    },
    {
      "club_id": "team:2025-26:14",
      "current_price": 9.0,
      "player_id": "player:2025-26:449",
      "position": "MID",
      "purchase_price": 9.0,
      "selling_price": 9.0
    },
    {
      "club_id": "team:2025-26:3",
      "current_price": 4.0,
      "player_id": "player:2025-26:470",
      "position": "GKP",
      "purchase_price": 4.0,
      "selling_price": 4.0
    },
    {
      "club_id": "team:2025-26:16",
      "current_price": 5.5,
      "player_id": "player:2025-26:506",
      "position": "DEF",
      "purchase_price": 5.5,
      "selling_price": 5.5
    },
    {
      "club_id": "team:2025-26:18",
      "current_price": 5.6,
      "player_id": "player:2025-26:568",
      "position": "DEF",
      "purchase_price": 5.5,
      "selling_price": 5.5
    },
    {
      "club_id": "team:2025-26:2",
      "current_price": 8.8,
      "player_id": "player:2025-26:64",
      "position": "FWD",
      "purchase_price": 9.0,
      "selling_price": 8.8
    },
    {
      "club_id": "team:2025-26:4",
      "current_price": 4.7,
      "player_id": "player:2025-26:72",
      "position": "DEF",
      "purchase_price": 4.5,
      "selling_price": 4.6
    }
  ],
  "state_id": "policy-state:benchmark-v0-official-scout-gw1:human_decision:gw06:7e5059407276",
  "status": "active",
  "transition_id": "state-transition:2025-26:gw05:human_decision:7e5059407276"
}
