{
  "bank": 2.9,
  "chip_history": [],
  "chips_available": [
    "wildcard_sh",
    "free_hit_sh",
    "triple_captain_sh",
    "bench_boost_sh"
  ],
  "content_sha256": "1c9a5c88eacc92ab27596894476429237ed87761926a9f4b46803f8146fc4378",
  "cumulative_points": 1828,
  "free_transfers": 2,
  "gameweek": 36,
  "origin": {
    "seed_id": "benchmark-v0-official-scout-gw1",
    "seed_sha256": "e0d798bcfd3a527ac896ed6c7191376d9ef7a8f776fb0ec1fe71f4bdcbbd0297",
    "type": "controlled_shared_seed"
  },
  "policy_arm": "evidence_agent",
  "previous_state_sha256": "b1aec9e6e11efc4ff457222dced2f7468abfbbc459ac6c2861a53fe79e6410c7",
  "ruleset_id": "2025-26-v1.0",
  "ruleset_sha256": "376e6a7982b54bce8562a73cfd749f30c2d869c50bfa036a531b96c90bb5a809",
  "schema_version": "1.0",
  "season": "2025-26",
  "squad": [
    {
      "club_id": "team:2025-26:14",
      "current_price": 8.4,
      "player_id": "player:2025-26:119",
      "position": "MID",
      "purchase_price": 8.7,
      "selling_price": 8.4
    },
    {
      "club_id": "team:2025-26:1",
      "current_price": 7.2,
      "player_id": "player:2025-26:21",
      "position": "MID",
      "purchase_price": 7.2,
      "selling_price": 7.2
    },
    {
      "club_id": "team:2025-26:7",
      "current_price": 7.5,
      "player_id": "player:2025-26:249",
      "position": "FWD",
      "purchase_price": 7.7,
      "selling_price": 7.5
    },
    {
      "club_id": "team:2025-26:7",
      "current_price": 4.0,
      "player_id": "player:2025-26:252",
      "position": "FWD",
      "purchase_price": 4.5,
      "selling_price": 4.0
    },
    {
      "club_id": "team:2025-26:8",
      "current_price": 5.1,
      "player_id": "player:2025-26:253",
      "position": "GKP",
      "purchase_price": 5.0,
      "selling_price": 5.0
    },
    {
      "club_id": "team:2025-26:13",
      "current_price": 5.1,
      "player_id": "player:2025-26:260",
      "position": "DEF",
      "purchase_price": 5.2,
      "selling_price": 5.1
    },
    {
      "club_id": "team:2025-26:10",
      "current_price": 6.0,
      "player_id": "player:2025-26:329",
      "position": "MID",
      "purchase_price": 5.7,
      "selling_price": 5.8
    },
    {
      "club_id": "team:2025-26:12",
      "current_price": 6.2,
      "player_id": "player:2025-26:373",
      "position": "DEF",
      "purchase_price": 5.9,
      "selling_price": 6.0
    },
    {
      "club_id": "team:2025-26:14",
      "current_price": 10.4,
      "player_id": "player:2025-26:449",
      "position": "MID",
      "purchase_price": 10.3,
      "selling_price": 10.3
    },
    {
      "club_id": "team:2025-26:2",
      "current_price": 7.5,
      "player_id": "player:2025-26:47",
      "position": "MID",
      "purchase_price": 7.0,
      "selling_price": 7.2
    },
    {
      "club_id": "team:2025-26:3",
      "current_price": 4.0,
      "player_id": "player:2025-26:470",
      "position": "GKP",
      "purchase_price": 4.0,
      "selling_price": 4.0
    },
    {
      "club_id": "team:2025-26:1",
      "current_price": 7.2,
      "player_id": "player:2025-26:5",
      "position": "DEF",
      "purchase_price": 7.0,
      "selling_price": 7.1
    },
    {
      "club_id": "team:2025-26:19",
      "current_price": 7.8,
      "player_id": "player:2025-26:624",
      "position": "FWD",
      "purchase_price": 7.6,
      "selling_price": 7.7
    },
    {
      "club_id": "team:2025-26:4",
      "current_price": 5.2,
      "player_id": "player:2025-26:72",
      "position": "DEF",
      "purchase_price": 4.5,
      "selling_price": 4.8
    },
    {
      "club_id": "team:2025-26:1",
      "current_price": 6.1,
      "player_id": "player:2025-26:8",
      "position": "DEF",
      "purchase_price": 5.8,
      "selling_price": 5.9
    }
  ],
  "state_id": "policy-state:benchmark-v0-official-scout-gw1:evidence_agent:gw36:13dfdda9fc0f",
  "status": "active",
  "transition_id": "state-transition:2025-26:gw35:evidence_agent:13dfdda9fc0f"
}
