{
  "bank": 0.3,
  "chip_history": [],
  "chips_available": [
    "wildcard_sh",
    "free_hit_sh",
    "triple_captain_sh",
    "bench_boost_sh"
  ],
  "content_sha256": "343b34ff781f1ed1e29660dff8b50615f05a352db2eb8411bd73b6611a93df15",
  "cumulative_points": 1749,
  "free_transfers": 1,
  "gameweek": 34,
  "origin": {
    "seed_id": "benchmark-v0-official-scout-gw1",
    "seed_sha256": "e0d798bcfd3a527ac896ed6c7191376d9ef7a8f776fb0ec1fe71f4bdcbbd0297",
    "type": "controlled_shared_seed"
  },
  "policy_arm": "human_decision",
  "previous_state_sha256": "ce9176a57d4845b3523eff6fafdac35c44eac27cc3520715eaba3073a1770283",
  "ruleset_id": "2025-26-v1.0",
  "ruleset_sha256": "376e6a7982b54bce8562a73cfd749f30c2d869c50bfa036a531b96c90bb5a809",
  "schema_version": "1.0",
  "season": "2025-26",
  "squad": [
    {
      "club_id": "team:2025-26:6",
      "current_price": 4.9,
      "player_id": "player:2025-26:173",
      "position": "MID",
      "purchase_price": 4.9,
      "selling_price": 4.9
    },
    {
      "club_id": "team:2025-26:7",
      "current_price": 5.4,
      "player_id": "player:2025-26:226",
      "position": "DEF",
      "purchase_price": 5.2,
      "selling_price": 5.3
    },
    {
      "club_id": "team:2025-26:7",
      "current_price": 7.7,
      "player_id": "player:2025-26:249",
      "position": "FWD",
      "purchase_price": 7.7,
      "selling_price": 7.7
    },
    {
      "club_id": "team:2025-26:7",
      "current_price": 4.0,
      "player_id": "player:2025-26:252",
      "position": "FWD",
      "purchase_price": 4.5,
      "selling_price": 4.0
    },
    {
      "club_id": "team:2025-26:13",
      "current_price": 5.1,
      "player_id": "player:2025-26:260",
      "position": "DEF",
      "purchase_price": 5.1,
      "selling_price": 5.1
    },
    {
      "club_id": "team:2025-26:11",
      "current_price": 3.9,
      "player_id": "player:2025-26:348",
      "position": "DEF",
      "purchase_price": 4.0,
      "selling_price": 3.9
    },
    {
      "club_id": "team:2025-26:13",
      "current_price": 14.5,
      "player_id": "player:2025-26:430",
      "position": "FWD",
      "purchase_price": 14.4,
      "selling_price": 14.4
    },
    {
      "club_id": "team:2025-26:14",
      "current_price": 10.3,
      "player_id": "player:2025-26:449",
      "position": "MID",
      "purchase_price": 10.1,
      "selling_price": 10.2
    },
    {
      "club_id": "team:2025-26:2",
      "current_price": 7.4,
      "player_id": "player:2025-26:47",
      "position": "MID",
      "purchase_price": 7.4,
      "selling_price": 7.4
    },
    {
      "club_id": "team:2025-26:3",
      "current_price": 4.0,
      "player_id": "player:2025-26:470",
      "position": "GKP",
      "purchase_price": 4.0,
      "selling_price": 4.0
    },
    {
      "club_id": "team:2025-26:1",
      "current_price": 7.1,
      "player_id": "player:2025-26:5",
      "position": "DEF",
      "purchase_price": 6.6,
      "selling_price": 6.8
    },
    {
      "club_id": "team:2025-26:17",
      "current_price": 4.8,
      "player_id": "player:2025-26:670",
      "position": "GKP",
      "purchase_price": 4.9,
      "selling_price": 4.8
    },
    {
      "club_id": "team:2025-26:6",
      "current_price": 5.5,
      "player_id": "player:2025-26:783",
      "position": "MID",
      "purchase_price": 5.5,
      "selling_price": 5.5
    },
    {
      "club_id": "team:2025-26:1",
      "current_price": 6.2,
      "player_id": "player:2025-26:8",
      "position": "DEF",
      "purchase_price": 6.4,
      "selling_price": 6.2
    },
    {
      "club_id": "team:2025-26:13",
      "current_price": 8.2,
      "player_id": "player:2025-26:82",
      "position": "MID",
      "purchase_price": 8.3,
      "selling_price": 8.2
    }
  ],
  "state_id": "policy-state:benchmark-v0-official-scout-gw1:human_decision:gw34:55cab3a591d0",
  "status": "active",
  "transition_id": "state-transition:2025-26:gw33:human_decision:55cab3a591d0"
}
