{
  "bank": 0.5,
  "chip_history": [],
  "chips_available": [
    "wildcard_sh",
    "free_hit_sh",
    "triple_captain_sh",
    "bench_boost_sh"
  ],
  "content_sha256": "f241d6fc96340771380cc56b463c716fb81c4d12aab8e079a7a63cec53b94e6b",
  "cumulative_points": 1072,
  "free_transfers": 5,
  "gameweek": 22,
  "origin": {
    "seed_id": "benchmark-v0-official-scout-gw1",
    "seed_sha256": "e0d798bcfd3a527ac896ed6c7191376d9ef7a8f776fb0ec1fe71f4bdcbbd0297",
    "type": "controlled_shared_seed"
  },
  "policy_arm": "evidence_challenger",
  "previous_state_sha256": "ad1d22eba621ba15d378b24d2456fb85c6d986266f0826335e2fd3c5231a8ac2",
  "ruleset_id": "2025-26-v1.0",
  "ruleset_sha256": "376e6a7982b54bce8562a73cfd749f30c2d869c50bfa036a531b96c90bb5a809",
  "schema_version": "1.0",
  "season": "2025-26",
  "squad": [
    {
      "club_id": "team:2025-26:5",
      "current_price": 7.0,
      "player_id": "player:2025-26:136",
      "position": "FWD",
      "purchase_price": 7.2,
      "selling_price": 7.0
    },
    {
      "club_id": "team:2025-26:1",
      "current_price": 7.2,
      "player_id": "player:2025-26:21",
      "position": "MID",
      "purchase_price": 7.0,
      "selling_price": 7.1
    },
    {
      "club_id": "team:2025-26:7",
      "current_price": 4.9,
      "player_id": "player:2025-26:220",
      "position": "GKP",
      "purchase_price": 5.0,
      "selling_price": 4.9
    },
    {
      "club_id": "team:2025-26:7",
      "current_price": 5.5,
      "player_id": "player:2025-26:226",
      "position": "DEF",
      "purchase_price": 5.2,
      "selling_price": 5.3
    },
    {
      "club_id": "team:2025-26:7",
      "current_price": 4.3,
      "player_id": "player:2025-26:252",
      "position": "FWD",
      "purchase_price": 4.5,
      "selling_price": 4.3
    },
    {
      "club_id": "team:2025-26:8",
      "current_price": 5.3,
      "player_id": "player:2025-26:260",
      "position": "DEF",
      "purchase_price": 5.1,
      "selling_price": 5.2
    },
    {
      "club_id": "team:2025-26:9",
      "current_price": 5.7,
      "player_id": "player:2025-26:291",
      "position": "DEF",
      "purchase_price": 5.6,
      "selling_price": 5.6
    },
    {
      "club_id": "team:2025-26:11",
      "current_price": 3.9,
      "player_id": "player:2025-26:348",
      "position": "DEF",
      "purchase_price": 4.0,
      "selling_price": 3.9
    },
    {
      "club_id": "team:2025-26:13",
      "current_price": 8.8,
      "player_id": "player:2025-26:414",
      "position": "MID",
      "purchase_price": 8.7,
      "selling_price": 8.7
    },
    {
      "club_id": "team:2025-26:13",
      "current_price": 15.1,
      "player_id": "player:2025-26:430",
      "position": "FWD",
      "purchase_price": 14.9,
      "selling_price": 15.0
    },
    {
      "club_id": "team:2025-26:14",
      "current_price": 8.2,
      "player_id": "player:2025-26:450",
      "position": "MID",
      "purchase_price": 8.0,
      "selling_price": 8.1
    },
    {
      "club_id": "team:2025-26:2",
      "current_price": 7.6,
      "player_id": "player:2025-26:47",
      "position": "MID",
      "purchase_price": 7.4,
      "selling_price": 7.5
    },
    {
      "club_id": "team:2025-26:3",
      "current_price": 4.0,
      "player_id": "player:2025-26:470",
      "position": "GKP",
      "purchase_price": 4.0,
      "selling_price": 4.0
    },
    {
      "club_id": "team:2025-26:4",
      "current_price": 4.8,
      "player_id": "player:2025-26:72",
      "position": "DEF",
      "purchase_price": 4.5,
      "selling_price": 4.6
    },
    {
      "club_id": "team:2025-26:4",
      "current_price": 7.6,
      "player_id": "player:2025-26:82",
      "position": "MID",
      "purchase_price": 7.8,
      "selling_price": 7.6
    }
  ],
  "state_id": "policy-state:benchmark-v0-official-scout-gw1:evidence_challenger:gw22:d5c45b8f27e9",
  "status": "active",
  "transition_id": "state-transition:2025-26:gw21:evidence_challenger:d5c45b8f27e9"
}
