{
  "bank": 1.4,
  "chip_history": [],
  "chips_available": [
    "wildcard_fh",
    "free_hit_fh",
    "triple_captain_fh",
    "bench_boost_fh",
    "wildcard_sh",
    "free_hit_sh",
    "triple_captain_sh",
    "bench_boost_sh"
  ],
  "content_sha256": "b76a7ed006be62379b3a0c5f76a4810a013466413881bfbd6d01709be7893156",
  "cumulative_points": 736,
  "free_transfers": 5,
  "gameweek": 16,
  "origin": {
    "seed_id": "benchmark-v0-official-scout-gw1",
    "seed_sha256": "e0d798bcfd3a527ac896ed6c7191376d9ef7a8f776fb0ec1fe71f4bdcbbd0297",
    "type": "controlled_shared_seed"
  },
  "policy_arm": "forecast_optimizer",
  "previous_state_sha256": "fe36de2ad97d0ffd1989e487a7572654c47c4883b038a148d40a3f097af462a8",
  "ruleset_id": "2025-26-v1.0",
  "ruleset_sha256": "376e6a7982b54bce8562a73cfd749f30c2d869c50bfa036a531b96c90bb5a809",
  "schema_version": "1.0",
  "season": "2025-26",
  "squad": [
    {
      "club_id": "team:2025-26:14",
      "current_price": 8.5,
      "player_id": "player:2025-26:119",
      "position": "MID",
      "purchase_price": 8.0,
      "selling_price": 8.2
    },
    {
      "club_id": "team:2025-26:1",
      "current_price": 7.1,
      "player_id": "player:2025-26:21",
      "position": "MID",
      "purchase_price": 7.0,
      "selling_price": 7.0
    },
    {
      "club_id": "team:2025-26:7",
      "current_price": 4.8,
      "player_id": "player:2025-26:220",
      "position": "GKP",
      "purchase_price": 5.0,
      "selling_price": 4.8
    },
    {
      "club_id": "team:2025-26:7",
      "current_price": 4.2,
      "player_id": "player:2025-26:252",
      "position": "FWD",
      "purchase_price": 4.5,
      "selling_price": 4.2
    },
    {
      "club_id": "team:2025-26:8",
      "current_price": 6.1,
      "player_id": "player:2025-26:256",
      "position": "DEF",
      "purchase_price": 5.8,
      "selling_price": 5.9
    },
    {
      "club_id": "team:2025-26:8",
      "current_price": 5.1,
      "player_id": "player:2025-26:260",
      "position": "DEF",
      "purchase_price": 5.1,
      "selling_price": 5.1
    },
    {
      "club_id": "team:2025-26:11",
      "current_price": 4.1,
      "player_id": "player:2025-26:348",
      "position": "DEF",
      "purchase_price": 4.0,
      "selling_price": 4.0
    },
    {
      "club_id": "team:2025-26:12",
      "current_price": 7.5,
      "player_id": "player:2025-26:384",
      "position": "MID",
      "purchase_price": 7.6,
      "selling_price": 7.5
    },
    {
      "club_id": "team:2025-26:12",
      "current_price": 6.6,
      "player_id": "player:2025-26:387",
      "position": "MID",
      "purchase_price": 6.5,
      "selling_price": 6.5
    },
    {
      "club_id": "team:2025-26:13",
      "current_price": 15.0,
      "player_id": "player:2025-26:430",
      "position": "FWD",
      "purchase_price": 14.9,
      "selling_price": 14.9
    },
    {
      "club_id": "team:2025-26:3",
      "current_price": 4.0,
      "player_id": "player:2025-26:470",
      "position": "GKP",
      "purchase_price": 4.0,
      "selling_price": 4.0
    },
    {
      "club_id": "team:2025-26:15",
      "current_price": 7.5,
      "player_id": "player:2025-26:714",
      "position": "FWD",
      "purchase_price": 7.4,
      "selling_price": 7.4
    },
    {
      "club_id": "team:2025-26:4",
      "current_price": 5.0,
      "player_id": "player:2025-26:72",
      "position": "DEF",
      "purchase_price": 4.5,
      "selling_price": 4.7
    },
    {
      "club_id": "team:2025-26:1",
      "current_price": 6.4,
      "player_id": "player:2025-26:8",
      "position": "DEF",
      "purchase_price": 5.8,
      "selling_price": 6.1
    },
    {
      "club_id": "team:2025-26:4",
      "current_price": 7.7,
      "player_id": "player:2025-26:82",
      "position": "MID",
      "purchase_price": 7.8,
      "selling_price": 7.7
    }
  ],
  "state_id": "policy-state:benchmark-v0-official-scout-gw1:forecast_optimizer:gw16:446ba2ce9a08",
  "status": "active",
  "transition_id": "state-transition:2025-26:gw15:forecast_optimizer:446ba2ce9a08"
}
