{
  "bank": 0.0,
  "chip_history": [],
  "chips_available": [
    "wildcard_fh",
    "free_hit_fh",
    "triple_captain_fh",
    "bench_boost_fh",
    "wildcard_sh",
    "free_hit_sh",
    "triple_captain_sh",
    "bench_boost_sh"
  ],
  "content_sha256": "c7fe9cc8d24e48b72455b2814a62feb1476bb71ad6b5c2cdc81d4a3d1e4f4bfd",
  "cumulative_points": 56,
  "free_transfers": 1,
  "gameweek": 2,
  "origin": {
    "seed_id": "benchmark-v0-official-scout-gw1",
    "seed_sha256": "e0d798bcfd3a527ac896ed6c7191376d9ef7a8f776fb0ec1fe71f4bdcbbd0297",
    "type": "controlled_shared_seed"
  },
  "policy_arm": "evidence_challenger",
  "previous_state_sha256": "9898615cc56cdb7f7334f70c8f47fa44b528e2ad7910393959aa6f7ce19f2183",
  "ruleset_id": "2025-26-v1.0",
  "ruleset_sha256": "376e6a7982b54bce8562a73cfd749f30c2d869c50bfa036a531b96c90bb5a809",
  "schema_version": "1.0",
  "season": "2025-26",
  "squad": [
    {
      "club_id": "team:2025-26:7",
      "current_price": 5.0,
      "player_id": "player:2025-26:220",
      "position": "GKP",
      "purchase_price": 5.0,
      "selling_price": 5.0
    },
    {
      "club_id": "team:2025-26:7",
      "current_price": 10.5,
      "player_id": "player:2025-26:235",
      "position": "MID",
      "purchase_price": 10.5,
      "selling_price": 10.5
    },
    {
      "club_id": "team:2025-26:7",
      "current_price": 7.5,
      "player_id": "player:2025-26:249",
      "position": "FWD",
      "purchase_price": 7.5,
      "selling_price": 7.5
    },
    {
      "club_id": "team:2025-26:17",
      "current_price": 4.5,
      "player_id": "player:2025-26:252",
      "position": "FWD",
      "purchase_price": 4.5,
      "selling_price": 4.5
    },
    {
      "club_id": "team:2025-26:9",
      "current_price": 5.5,
      "player_id": "player:2025-26:291",
      "position": "DEF",
      "purchase_price": 5.5,
      "selling_price": 5.5
    },
    {
      "club_id": "team:2025-26:11",
      "current_price": 4.0,
      "player_id": "player:2025-26:348",
      "position": "DEF",
      "purchase_price": 4.0,
      "selling_price": 4.0
    },
    {
      "club_id": "team:2025-26:12",
      "current_price": 14.5,
      "player_id": "player:2025-26:381",
      "position": "MID",
      "purchase_price": 14.5,
      "selling_price": 14.5
    },
    {
      "club_id": "team:2025-26:13",
      "current_price": 5.5,
      "player_id": "player:2025-26:427",
      "position": "MID",
      "purchase_price": 5.5,
      "selling_price": 5.5
    },
    {
      "club_id": "team:2025-26:14",
      "current_price": 9.0,
      "player_id": "player:2025-26:449",
      "position": "MID",
      "purchase_price": 9.0,
      "selling_price": 9.0
    },
    {
      "club_id": "team:2025-26:3",
      "current_price": 4.0,
      "player_id": "player:2025-26:470",
      "position": "GKP",
      "purchase_price": 4.0,
      "selling_price": 4.0
    },
    {
      "club_id": "team:2025-26:16",
      "current_price": 5.5,
      "player_id": "player:2025-26:506",
      "position": "DEF",
      "purchase_price": 5.5,
      "selling_price": 5.5
    },
    {
      "club_id": "team:2025-26:16",
      "current_price": 5.5,
      "player_id": "player:2025-26:517",
      "position": "MID",
      "purchase_price": 5.5,
      "selling_price": 5.5
    },
    {
      "club_id": "team:2025-26:18",
      "current_price": 5.5,
      "player_id": "player:2025-26:568",
      "position": "DEF",
      "purchase_price": 5.5,
      "selling_price": 5.5
    },
    {
      "club_id": "team:2025-26:2",
      "current_price": 9.0,
      "player_id": "player:2025-26:64",
      "position": "FWD",
      "purchase_price": 9.0,
      "selling_price": 9.0
    },
    {
      "club_id": "team:2025-26:4",
      "current_price": 4.5,
      "player_id": "player:2025-26:72",
      "position": "DEF",
      "purchase_price": 4.5,
      "selling_price": 4.5
    }
  ],
  "state_id": "policy-state:benchmark-v0-official-scout-gw1:evidence_challenger:gw02:52f8b0c1583f",
  "status": "active",
  "transition_id": "state-transition:2025-26:gw01:evidence_challenger:52f8b0c1583f"
}
