{
  "bank": 1.0,
  "chip_history": [],
  "chips_available": [
    "wildcard_sh",
    "free_hit_sh",
    "triple_captain_sh",
    "bench_boost_sh"
  ],
  "content_sha256": "40de50c3efdd21dc61adaa11717f0ec3435ac0eba5cbf7c6ed9cb65933c28ba2",
  "cumulative_points": 1627,
  "free_transfers": 5,
  "gameweek": 31,
  "origin": {
    "seed_id": "benchmark-v0-structured-prior-gw1-counterfactual",
    "seed_sha256": "b9693afe9cfb1984d465be7abe23240b567e1323391d8e7b3726576b4928f591",
    "type": "controlled_shared_seed"
  },
  "policy_arm": "evidence_agent",
  "previous_state_sha256": "98d4cdfddfb8a422eb605e98ab2220b4941785de1406e3d3ae919ce74ac62403",
  "ruleset_id": "2025-26-v1.0",
  "ruleset_sha256": "376e6a7982b54bce8562a73cfd749f30c2d869c50bfa036a531b96c90bb5a809",
  "schema_version": "1.0",
  "season": "2025-26",
  "squad": [
    {
      "club_id": "team:2025-26:5",
      "current_price": 7.2,
      "player_id": "player:2025-26:136",
      "position": "FWD",
      "purchase_price": 7.2,
      "selling_price": 7.2
    },
    {
      "club_id": "team:2025-26:1",
      "current_price": 7.4,
      "player_id": "player:2025-26:21",
      "position": "MID",
      "purchase_price": 7.0,
      "selling_price": 7.2
    },
    {
      "club_id": "team:2025-26:7",
      "current_price": 6.6,
      "player_id": "player:2025-26:237",
      "position": "MID",
      "purchase_price": 6.6,
      "selling_price": 6.6
    },
    {
      "club_id": "team:2025-26:8",
      "current_price": 5.0,
      "player_id": "player:2025-26:253",
      "position": "GKP",
      "purchase_price": 5.0,
      "selling_price": 5.0
    },
    {
      "club_id": "team:2025-26:13",
      "current_price": 5.2,
      "player_id": "player:2025-26:260",
      "position": "DEF",
      "purchase_price": 5.2,
      "selling_price": 5.2
    },
    {
      "club_id": "team:2025-26:10",
      "current_price": 6.0,
      "player_id": "player:2025-26:329",
      "position": "MID",
      "purchase_price": 5.7,
      "selling_price": 5.8
    },
    {
      "club_id": "team:2025-26:12",
      "current_price": 6.2,
      "player_id": "player:2025-26:373",
      "position": "DEF",
      "purchase_price": 5.9,
      "selling_price": 6.0
    },
    {
      "club_id": "team:2025-26:13",
      "current_price": 14.6,
      "player_id": "player:2025-26:430",
      "position": "FWD",
      "purchase_price": 14.9,
      "selling_price": 14.6
    },
    {
      "club_id": "team:2025-26:2",
      "current_price": 7.5,
      "player_id": "player:2025-26:47",
      "position": "MID",
      "purchase_price": 7.0,
      "selling_price": 7.2
    },
    {
      "club_id": "team:2025-26:1",
      "current_price": 7.2,
      "player_id": "player:2025-26:5",
      "position": "DEF",
      "purchase_price": 6.9,
      "selling_price": 7.0
    },
    {
      "club_id": "team:2025-26:16",
      "current_price": 4.6,
      "player_id": "player:2025-26:502",
      "position": "GKP",
      "purchase_price": 5.0,
      "selling_price": 4.6
    },
    {
      "club_id": "team:2025-26:19",
      "current_price": 4.1,
      "player_id": "player:2025-26:610",
      "position": "DEF",
      "purchase_price": 4.5,
      "selling_price": 4.1
    },
    {
      "club_id": "team:2025-26:20",
      "current_price": 4.5,
      "player_id": "player:2025-26:749",
      "position": "FWD",
      "purchase_price": 4.6,
      "selling_price": 4.5
    },
    {
      "club_id": "team:2025-26:1",
      "current_price": 6.3,
      "player_id": "player:2025-26:8",
      "position": "DEF",
      "purchase_price": 6.1,
      "selling_price": 6.2
    },
    {
      "club_id": "team:2025-26:13",
      "current_price": 8.3,
      "player_id": "player:2025-26:82",
      "position": "MID",
      "purchase_price": 7.0,
      "selling_price": 7.6
    }
  ],
  "state_id": "policy-state:benchmark-v0-structured-prior-gw1-counterfactual:evidence_agent:gw31:84ce4f79a685",
  "status": "active",
  "transition_id": "state-transition:2025-26:gw30:evidence_agent:84ce4f79a685"
}
